{
  "task_id": "task-001",
  "observable": "delta_a_mu",
  "python_function": "delta_a_mu",
  "python_file": "result-python.py",
  "parameters": [
    {
      "canonical_name": "m_mu",
      "role": "fixed",
      "unit": "GeV"
    },
    {
      "canonical_name": "M_Zp",
      "role": "scan",
      "unit": "GeV"
    },
    {
      "canonical_name": "g_prime",
      "role": "scan",
      "unit": "dimensionless"
    }
  ],
  "return_value": {
    "name": "delta_a_mu",
    "unit": "dimensionless",
    "description": "One-loop Z' contribution to muon (g-2)/2"
  },
  "translation_status": "complete",
  "translation_notes": "",
  "source_wl": "result.wl",
  "calculation_provenance": "package_x_derived",
  "benchmark_used_as_input": false,
  "package_x_methods": [
    "LoopIntegrate",
    "LoopRefine",
    "Projector"
  ],
  "provenance_notes": "finalResult is derived in result.wl before benchmark verification is read or applied.",
  "benchmark_status": "pass",
  "depends_on": {
    "model_version": "v1",
    "model_checksum": "sha256:abc123..."
  }
}
